Libro,Capítulo,Versículo,Texto
Hebreos,5,12,"Porque debiendo ser ya maestros a causa del tiempo, tenéis necesidad de volver a ser enseñados cuáles sean los primeros rudimentos de las palabras de Dios; y habéis llegado a ser tales que tengáis necesidad de leche, y no de manjar sólido. και γαρ οφειλοντες ειναι διδασκαλοι δια τον χρονον παλιν χρειαν εχετε του διδασκειν υμας τινα τα στοιχεια της αρχης των λογιων του θεου και γεγονατε χρειαν εχοντες γαλακτος ου στερεας τροφης"
Hebreos,5,13,"Que cualquiera que participa de la leche, es inhábil para la palabra de la justicia, porque es niño; πας γαρ ο μετεχων γαλακτος απειρος λογου δικαιοσυνης νηπιος γαρ εστιν"
Hebreos,5,14,"mas la vianda firme es para los perfectos, para los que por la costumbre tienen los sentidos ejercitados en el discernimiento del bien y del mal. τελειων δε εστιν η στερεα τροφη των δια την εξιν τα αισθητηρια γεγυμνασμενα εχοντων προς διακρισιν καλου τε και κακου"
Hebreos,6,1,"Por tanto, dejando la palabra del comienzo en la doctrina de Cristo, vamos adelante a la perfección; no echando otra vez el fundamento; no arrepentimiento de obras muertas, y de la fe en Dios, διο αφεντες τον της αρχης του χριστου λογον επι την τελειοτητα φερωμεθα μη παλιν θεμελιον καταβαλλομενοι μετανοιας απο νεκρων εργων και πιστεως επι θεον"
Hebreos,6,2,"de la doctrina de bautismos, y de la imposición de manos, y de la resurrección de los muertos, y del juicio eterno. βαπτισμων διδαχην επιθεσεως τε χειρων αναστασεως νεκρων και κριματος αιωνιου"
Hebreos,6,3,"Y esto haremos a la verdad, si Dios lo permitiere. και τουτο ποιησομεν εανπερ επιτρεπη ο θεος"
Hebreos,6,4,"Porque es imposible que los que una vez fueron iluminados y gustaron el don celestial, y fueron hechos partícipes del Espíritu Santo. αδυνατον γαρ τους απαξ φωτισθεντας γευσαμενους τε της δωρεας της επουρανιου και μετοχους γενηθεντας πνευματος αγιου"
Hebreos,6,5,"Y asimismo gustaron la buena palabra de Dios, y las virtudes del siglo venidero, και καλον γευσαμενους θεου ρημα δυναμεις τε μελλοντος αιωνος"
Hebreos,6,6,"y recayeron, sean otra vez renovados para arrepentimiento, crucificando de nuevo para sí mismos al Hijo de Dios, y exponiéndole a vituperio. και παραπεσοντας παλιν ανακαινιζειν εις μετανοιαν ανασταυρουντας εαυτοις τον υιον του θεου και παραδειγματιζοντας"
Hebreos,6,7,"Porque la tierra que embebe el agua que muchas veces vino sobre ella, y produce hierba provechosa a aquellos de los cuales es labrada, recibe bendición de Dios: γη γαρ η πιουσα τον επ αυτης ερχομενον πολλακις υετον και τικτουσα βοτανην ευθετον εκεινοις δι ους και γεωργειται μεταλαμβανει ευλογιας απο του θεου"
Hebreos,6,8,"Mas la que produce espinas y abrojos, es reprobada, y cercana de maldición; cuyo fin será el ser abrasada. εκφερουσα δε ακανθας και τριβολους αδοκιμος και καταρας εγγυς ης το τελος εις καυσιν"
Hebreos,6,9,"Pero de vosotros, oh amados, esperamos mejores cosas, y más cercanas a salud, aunque hablamos así. πεπεισμεθα δε περι υμων αγαπητοι τα κρεισσονα και εχομενα σωτηριας ει και ουτως λαλουμεν"
Hebreos,6,10,"Porque Dios no es injusto para olvidar vuestra obra y el trabajo de amor que habéis mostrado a su nombre, habiendo asistido y asistiendo aún a los santos. ου γαρ αδικος ο θεος επιλαθεσθαι του εργου υμων και της αγαπης ης ενεδειξασθε εις το ονομα αυτου διακονησαντες τοις αγιοις και διακονουντες"
Hebreos,6,11,"Mas deseamos que cada uno de vosotros muestre la misma solicitud hasta el cabo, para cumplimiento de la esperanza: επιθυμουμεν δε εκαστον υμων την αυτην ενδεικνυσθαι σπουδην προς την πληροφοριαν της ελπιδος αχρι τελους"
Hebreos,6,12,"Que no os hagáis perezosos, mas imitadores de aquellos que por la fe y la paciencia heredan las promesas. ινα μη νωθροι γενησθε μιμηται δε των δια πιστεως και μακροθυμιας κληρονομουντων τας επαγγελιας"
Hebreos,6,13,"Porque prometiendo Dios a Abraham, no pudiendo jurar por otro mayor, juró por sí mismo, τω γαρ αβρααμ επαγγειλαμενος ο θεος επει κατ ουδενος ειχεν μειζονος ομοσαι ωμοσεν καθ εαυτου"
Hebreos,6,14,"diciendo: De cierto te bendeciré bendiciendo, y multiplicando te multiplicaré. λεγων ει μην ευλογων ευλογησω σε και πληθυνων πληθυνω σε"
Hebreos,6,15,"Y así, esperando con largura de ánimo, alcanzó la promesa. και ουτως μακροθυμησας επετυχεν της επαγγελιας"
Hebreos,6,16,Porque los hombres ciertamente por el mayor que ellos juran: y el fin de todas sus controversias es el juramento para confirmación. ανθρωποι γαρ κατα του μειζονος ομνυουσιν και πασης αυτοις αντιλογιας περας εις βεβαιωσιν ο ορκος
Hebreos,6,17,"Por lo cual, queriendo Dios mostrar más abundantemente a los herederos de la promesa la inmutabilidad de su consejo, interpuso juramento; εν ω περισσοτερον βουλομενος ο θεος επιδειξαι τοις κληρονομοις της επαγγελιας το αμεταθετον της βουλης αυτου εμεσιτευσεν ορκω"
Hebreos,6,18,"para que por dos cosas inmutables, en las cuales es imposible que Dios mienta, tengamos un fortísimo consuelo, los que nos acogemos a trabarnos de la esperanza propuesta: ινα δια δυο πραγματων αμεταθετων εν οις αδυνατον ψευσασθαι θεον ισχυραν παρακλησιν εχωμεν οι καταφυγοντες κρατησαι της προκειμενης ελπιδος"
Hebreos,6,19,"La cual tenemos como segura y firme ancla del alma, y que entra hasta dentro del velo; ην ως αγκυραν εχομεν της ψυχης ασφαλη τε και βεβαιαν και εισερχομενην εις το εσωτερον του καταπετασματος"
Hebreos,6,20,"donde entró por nosotros como precursor Jesús, hecho Pontífice eternalmente según el orden de Melchisedec. οπου προδρομος υπερ ημων εισηλθεν ιησους κατα την ταξιν μελχισεδεκ αρχιερευς γενομενος εις τον αιωνα"
Hebreos,7,1,"Porque este Melchisedec, rey de Salem, sacerdote del Dios Altísimo, el cual salió a recibir a Abraham que volvía de la derrota de los reyes, y le bendijo, ουτος γαρ ο μελχισεδεκ βασιλευς σαλημ ιερευς του θεου του υψιστου ο συναντησας αβρααμ υποστρεφοντι απο της κοπης των βασιλεων και ευλογησας αυτον"
Hebreos,7,2,"al cual asimismo dió Abraham los diezmos de todo, primeramente él se interpreta Rey de justicia; y luego también Rey de Salem, que es, Rey de paz; ω και δεκατην απο παντων εμερισεν αβρααμ πρωτον μεν ερμηνευομενος βασιλευς δικαιοσυνης επειτα δε και βασιλευς σαλημ ο εστιν βασιλευς ειρηνης"
Hebreos,7,3,"sin padre, sin madre, sin linaje; que ni tiene principio de días, ni fin de vida, mas hecho semejante al Hijo de Dios, permanece sacerdote para siempre. απατωρ αμητωρ αγενεαλογητος μητε αρχην ημερων μητε ζωης τελος εχων αφωμοιωμενος δε τω υιω του θεου μενει ιερευς εις το διηνεκες"
Hebreos,7,4,"Mirad pues cuán grande fué éste, al cual aun Abraham el patriarca dió diezmos de los despojos. θεωρειτε δε πηλικος ουτος ω δεκατην αβρααμ εδωκεν εκ των ακροθινιων ο πατριαρχης"
Hebreos,7,5,"Y ciertamente los que de los hijos de Leví toman el sacerdocio, tienen mandamiento de tomar del pueblo los diezmos según la ley, es a saber, de sus hermanos aunque también hayan salido de los lomos de Abraham. και οι μεν εκ των υιων λευι την ιερατειαν λαμβανοντες εντολην εχουσιν αποδεκατουν τον λαον κατα τον νομον τουτ εστιν τους αδελφους αυτων καιπερ εξεληλυθοτας εκ της οσφυος αβρααμ"
Hebreos,7,6,"Mas aquél cuya genealogía no es contada de ellos, tomó de Abraham los diezmos, y bendijo al que tenía las promesas. ο δε μη γενεαλογουμενος εξ αυτων δεδεκατωκεν αβρααμ και τον εχοντα τας επαγγελιας ευλογηκεν"
Hebreos,7,7,"Y sin contradicción alguna, lo que es menos es bendecido de lo que es más. χωρις δε πασης αντιλογιας το ελαττον υπο του κρειττονος ευλογειται"
Hebreos,7,8,"Y aquí ciertamente los hombres mortales toman los diezmos: mas allí, aquel del cual está dado testimonio que vive. και ωδε μεν δεκατας αποθνησκοντες ανθρωποι λαμβανουσιν εκει δε μαρτυρουμενος οτι ζη"
Hebreos,7,9,"Y, por decirlo así, en Abraham fué diezmado también Leví, que recibe los diezmos; και ως επος ειπειν δι αβρααμ και λευις ο δεκατας λαμβανων δεδεκατωται"
Hebreos,7,10,porque aún estaba en los lomos de su padre cuando Melchisedec le salió al encuentro. ετι γαρ εν τη οσφυι του πατρος ην οτε συνηντησεν αυτω μελχισεδεκ
Hebreos,7,11,"Si pues la perfección era por el sacerdocio Levítico (porque debajo de él recibio el pueblo la ley) ¿qué necesidad había aún de que se levantase otro sacerdote según el orden de Melchisedec, y que no fuese llamado según el orden de Aarón? ει μεν ουν τελειωσις δια της λευιτικης ιερωσυνης ην ο λαος γαρ επ αυτης νενομοθετηται τις ετι χρεια κατα την ταξιν μελχισεδεκ ετερον ανιστασθαι ιερεα και ου κατα την ταξιν ααρων λεγεσθαι"
Hebreos,7,12,"Pues mudado el sacerdocio, necesario es que se haga también mudanza de la ley. μετατιθεμενης γαρ της ιερωσυνης εξ αναγκης και νομου μεταθεσις γινεται"
Hebreos,7,13,"Porque aquel del cual esto se dice, de otra tribu es, de la cual nadie asistió al altar. εφ ον γαρ λεγεται ταυτα φυλης ετερας μετεσχηκεν αφ ης ουδεις προσεσχηκεν τω θυσιαστηριω"
Hebreos,7,14,"Porque notorio es que el Señor nuestro nació de la tribu de Judá, sobre cuya tribu nada habló Moisés tocante al sacerdocio. προδηλον γαρ οτι εξ ιουδα ανατεταλκεν ο κυριος ημων εις ην φυλην περι ιερεων ουδεν μωυσης ελαλησεν"
Hebreos,7,15,"Y aun más manifiesto es, si a semejanza de Melchîsedec se levanta otro sacerdote, και περισσοτερον ετι καταδηλον εστιν ει κατα την ομοιοτητα μελχισεδεκ ανισταται ιερευς ετερος"
Hebreos,7,16,"el cual no es hecho conforme a la ley del mandamiento carnal, sino según la virtud de vida indisoluble; ος ου κατα νομον εντολης σαρκινης γεγονεν αλλα κατα δυναμιν ζωης ακαταλυτου"
Hebreos,7,17,"pues se da testimonio de él: Tú eres sacerdote para siempre, según el orden de Melchisedec. μαρτυρειται γαρ οτι συ ιερευς εις τον αιωνα κατα την ταξιν μελχισεδεκ"
Hebreos,7,18,"El mandamiento precedente, cierto se abroga por su flaqueza e  inutilidad; αθετησις μεν γαρ γινεται προαγουσης εντολης δια το αυτης ασθενες και ανωφελες"
Hebreos,7,19,"porque nada perfeccionó la ley; mas hízolo la introducción de mejor esperanza, por la cual nos acercamos a Dios. ουδεν γαρ ετελειωσεν ο νομος επεισαγωγη δε κρειττονος ελπιδος δι ης εγγιζομεν τω θεω"
Hebreos,7,20,"Y por cuanto no fué sin juramento, και καθ οσον ου χωρις ορκωμοσιας οι μεν γαρ χωρις ορκωμοσιας εισιν ιερεις γεγονοτες"
Hebreos,7,21,"(Porque los otros cierto sin juramento fueron hechos sacerdotes; mas éste, con juramento por el que le dijo: Juró el Señor, y no se arrepentirá: Tú eres sacerdote eternamente, según el orden de Melchisedec) ο δε μετα ορκωμοσιας δια του λεγοντος προς αυτον ωμοσεν κυριος και ου μεταμεληθησεται συ ιερευς εις τον αιωνα"
Hebreos,7,22,Tanto de mejor testamento es hecho fiador Jesús. κατα τοσουτο και κρειττονος διαθηκης γεγονεν εγγυος ιησους
Hebreos,7,23,"Y los otros cierto fueron muchos sacerdotes, en cuanto por la muerte no podían permanecer. και οι μεν πλειονες εισιν γεγονοτες ιερεις δια το θανατω κωλυεσθαι παραμενειν"
Hebreos,7,24,"Mas éste, por cuanto permanece para siempre, tiene un sacerdocio inmutable: ο δε δια το μενειν αυτον εις τον αιωνα απαραβατον εχει την ιερωσυνην"
Hebreos,7,25,"Por lo cual puede también salvar eternamente a los que por él se allegan a Dios, viviendo siempre para interceder por ellos. οθεν και σωζειν εις το παντελες δυναται τους προσερχομενους δι αυτου τω θεω παντοτε ζων εις το εντυγχανειν υπερ αυτων"
Hebreos,7,26,"Porque tal pontífice nos convenía: santo, inocente, limpio, apartado de los pecadores, y hecho más sublime de los cielos; τοιουτος γαρ ημιν [και] επρεπεν αρχιερευς οσιος ακακος αμιαντος κεχωρισμενος απο των αμαρτωλων και υψηλοτερος των ουρανων γενομενος"
Hebreos,7,27,"que no tiene necesidad cada día, como los otros sacerdotes, de ofrecer primero sacrificios por sus pecados, y luego por los del pueblo: porque esto lo hizo una sola vez, ofreciéndose a sí mismo. ος ουκ εχει καθ ημεραν αναγκην ωσπερ οι αρχιερεις προτερον υπερ των ιδιων αμαρτιων θυσιας αναφερειν επειτα των του λαου τουτο γαρ εποιησεν εφαπαξ εαυτον ανενεγκας"
Hebreos,7,28,"Porque la ley constituye sacerdotes a hombres flacos; mas la palabra del juramento, después de la ley, constituye al Hijo, hecho perfecto para siempre. ο νομος γαρ ανθρωπους καθιστησιν αρχιερεις εχοντας ασθενειαν ο λογος δε της ορκωμοσιας της μετα τον νομον υιον εις τον αιωνα τετελειωμενον"
Hebreos,8,1,"Así que, la suma acerca de lo dicho es: Tenemos tal pontífice que se asentó a la diestra del trono de la Majestad en los cielos; κεφαλαιον δε επι τοις λεγομενοις τοιουτον εχομεν αρχιερεα ος εκαθισεν εν δεξια του θρονου της μεγαλωσυνης εν τοις ουρανοις"
Hebreos,8,2,"Ministro del santuario, y de aquel verdadero tabernáculo que el Señor asentó, y no hombre. των αγιων λειτουργος και της σκηνης της αληθινης ην επηξεν ο κυριος ουκ ανθρωπος"
Hebreos,8,3,Porque todo pontífice es puesto para ofrecer presentes y sacrificios; por lo cual es necesario que también éste tuviese algo que ofrecer. πας γαρ αρχιερευς εις το προσφερειν δωρα τε και θυσιας καθισταται οθεν αναγκαιον εχειν τι και τουτον ο προσενεγκη
Hebreos,8,4,"Así que, si estuviese sobre la tierra, ni aun sería sacerdote, habiendo aún los sacerdotes que ofrecen los presentes según la ley; ει μεν ουν ην επι γης ουδ αν ην ιερευς οντων των προσφεροντων κατα νομον τα δωρα"
Hebreos,8,5,"los cuales sirven de bosquejo y sombre de las cosas celestiales, como fué respondido a Moisés cuando había de acabar el tabernáculo: Mira, dice, haz todas las cosas conforme al dechado que te ha sido mostrado en el monte. οιτινες υποδειγματι και σκια λατρευουσιν των επουρανιων καθως κεχρηματισται μωυσης μελλων επιτελειν την σκηνην ορα γαρ φησιν ποιησεις παντα κατα τον τυπον τον δειχθεντα σοι εν τω ορει"
Hebreos,8,6,"Mas ahora tanto mejor ministerio es el suyo, cuanto es mediador de un mejor pacto, el cual ha sido formado sobre mejores promesas. νυν δε διαφορωτερας τετυχεν λειτουργιας οσω και κρειττονος εστιν διαθηκης μεσιτης ητις επι κρειττοσιν επαγγελιαις νενομοθετηται"
Hebreos,8,7,"Porque si aquel primero fuera sin falta, cierto no se hubiera procurado lugar de segundo. ει γαρ η πρωτη εκεινη ην αμεμπτος ουκ αν δευτερας εζητειτο τοπος"
Hebreos,8,8,"Porque reprendiéndolos dice: He aquí vienen días, dice el Señor, Y consumaré para con la casa de Israel y para con la casa de Judá un nuevo pacto; μεμφομενος γαρ αυτους λεγει ιδου ημεραι ερχονται λεγει κυριος και συντελεσω επι τον οικον ισραηλ και επι τον οικον ιουδα διαθηκην καινην"
Hebreos,8,9,"no como el pacto que hice con sus padres El día que los tomé por la mano para sacarlos de la tierra de Egipto: Porque ellos no permanecieron en mi pacto, Y yo los menosprecié, dice el Señor. ου κατα την διαθηκην ην εποιησα τοις πατρασιν αυτων εν ημερα επιλαβομενου μου της χειρος αυτων εξαγαγειν αυτους εκ γης αιγυπτου οτι αυτοι ουκ ενεμειναν εν τη διαθηκη μου καγω ημελησα αυτων λεγει κυριος"
Hebreos,8,10,"Por lo cual, este es el pacto que ordenaré a la casa de Israel Después de aquellos días, dice el Señor: Daré mis leyes en el alma de ellos, y sobre el corazón de ellos las escribiré; y seré a ellos por Dios, y ellos me serán a mí por pueblo: οτι αυτη η διαθηκη ην διαθησομαι τω οικω ισραηλ μετα τας ημερας εκεινας λεγει κυριος διδους νομους μου εις την διανοιαν αυτων και επι καρδιας αυτων επιγραψω αυτους και εσομαι αυτοις εις θεον και αυτοι εσονται μοι εις λαον"
Hebreos,8,11,"Y ninguno eneseñará a su prójimo, Ni ninguno a su hermano, diciendo: Conoce al Señor: Porque todos me conocerán, desde el menor de ellos hasta el mayor. και ου μη διδαξωσιν εκαστος τον πολιτην αυτου και εκαστος τον αδελφον αυτου λεγων γνωθι τον κυριον οτι παντες ειδησουσιν με απο μικρου εως μεγαλου αυτων"
Hebreos,8,12,"Porque seré propicio a sus injusticias, Y de sus pecados y de sus iniquidades no me acordaré más. οτι ιλεως εσομαι ταις αδικιαις αυτων και των αμαρτιων αυτων ου μη μνησθω ετι"
Hebreos,8,13,"Diciendo, Nuevo pacto, dió por viejo al primero; y lo que es dado por viejo y se envejece, cerca está de desvanecerse. εν τω λεγειν καινην πεπαλαιωκεν την πρωτην το δε παλαιουμενον και γηρασκον εγγυς αφανισμου"
Hebreos,9,1,"Tenía empero también el primer pacto reglamentos del culto, y santuario mundano. ειχεν μεν ουν [και] η πρωτη δικαιωματα λατρειας το τε αγιον κοσμικον"
Hebreos,9,2,"Porque el tabernáculo fué hecho: el primero, en que estaban las lámparas, y la mesa, y los panes de la proposición; lo que llaman el Santuario. σκηνη γαρ κατεσκευασθη η πρωτη εν η η τε λυχνια και η τραπεζα και η προθεσις των αρτων ητις λεγεται αγια"
Hebreos,9,3,"Tras el segundo velo estaba el tabernáculo, que llaman el Lugar Santísimo; μετα δε το δευτερον καταπετασμα σκηνη η λεγομενη αγια αγιων"
Hebreos,9,4,"el cual tenía un incensario de oro, y el arca del pacto cubierta de todas partes alrededor de oro; en la que estaba una urna de oro que contenía el maná, y la vara de Aarón que reverdeció, y las tablas del pacto; χρυσουν εχουσα θυμιατηριον και την κιβωτον της διαθηκης περικεκαλυμμενην παντοθεν χρυσιω εν η σταμνος χρυση εχουσα το μαννα και η ραβδος ααρων η βλαστησασα και αι πλακες της διαθηκης"
Hebreos,9,5,y sobre ella los querubines de gloria que cubrían el propiciatorio; de las cuales cosas no se puede ahora hablar en particular. υπερανω δε αυτης χερουβιν δοξης κατασκιαζοντα το ιλαστηριον περι ων ουκ εστιν νυν λεγειν κατα μερος
Hebreos,9,6,"Y estas cosas así ordenadas, en el primer tabernáculo siempre entraban los sacerdotes para hacer los oficios del culto; τουτων δε ουτως κατεσκευασμενων εις μεν την πρωτην σκηνην δια παντος εισιασιν οι ιερεις τας λατρειας επιτελουντες"
Hebreos,9,7,"mas en el segundo, sólo el pontífice una vez en el año, no sin sangre, la cual ofrece por sí mismo, y por los pecados de ignorancia del pueblo: εις δε την δευτεραν απαξ του ενιαυτου μονος ο αρχιερευς ου χωρις αιματος ο προσφερει υπερ εαυτου και των του λαου αγνοηματων"
Hebreos,9,8,"Dando en esto a entender el Espíritu Santo, que aun no estaba descubierto el camino para el santuario, entre tanto que el primer tabernáculo estuviese en pie. τουτο δηλουντος του πνευματος του αγιου μηπω πεφανερωσθαι την των αγιων οδον ετι της πρωτης σκηνης εχουσης στασιν"
Hebreos,9,9,"Lo cual era figura de aquel tiempo presente, en el cual se ofrecían presentes y sacrificios que no podían hacer perfecto, cuanto a la conciencia, al que servía con ellos; ητις παραβολη εις τον καιρον τον ενεστηκοτα καθ ην δωρα τε και θυσιαι προσφερονται μη δυναμεναι κατα συνειδησιν τελειωσαι τον λατρευοντα"
Hebreos,9,10,"consistiendo sólo en viandas y en bebidas, y en diversos lavamientos, y ordenanzas acerca de la carne, impuestas hasta el tiempo de la corrección. μονον επι βρωμασιν και πομασιν και διαφοροις βαπτισμοις δικαιωματα σαρκος μεχρι καιρου διορθωσεως επικειμενα"
Hebreos,9,11,"Mas estando ya presente Cristo, pontífice de los bienes que habían de venir, por el más amplio y más perfecto tabernáculo, no hecho de manos, es a saber, no de esta creación; χριστος δε παραγενομενος αρχιερευς των γενομενων αγαθων δια της μειζονος και τελειοτερας σκηνης ου χειροποιητου τουτ εστιν ου ταυτης της κτισεως"
