Libro,Capítulo,Versículo,Texto
Hebreos,9,12,"y no por sangre de machos cabríos ni de becerros, mas por su propia sangre, entró una sola vez en el santuario, habiendo obtenido eterna redención. ουδε δι αιματος τραγων και μοσχων δια δε του ιδιου αιματος εισηλθεν εφαπαξ εις τα αγια αιωνιαν λυτρωσιν ευραμενος"
Hebreos,9,13,"Porque si la sangre de los toros y de los machos cabríos, y la ceniza de la becerra, rociada a los inmundos, santifica para la purificación de la carne, ει γαρ το αιμα τραγων και ταυρων και σποδος δαμαλεως ραντιζουσα τους κεκοινωμενους αγιαζει προς την της σαρκος καθαροτητα"
Hebreos,9,14,"¿Cuánto más la sangre de Cristo, el cual por el Espíritu eterno se ofreció a sí mismo sin mancha a Dios, limpiará vuestras conciencias de las obras de muerte para que sirváis al Dios vivo? ποσω μαλλον το αιμα του χριστου ος δια πνευματος αιωνιου εαυτον προσηνεγκεν αμωμον τω θεω καθαριει την συνειδησιν ημων απο νεκρων εργων εις το λατρευειν θεω ζωντι"
Hebreos,9,15,"Así que, por eso es mediador del nuevo testamento, para que interviniendo muerte para la remisión de las rebeliones que había bajo del primer testamento, los que son llamados reciban la promesa de la herencia eterna. και δια τουτο διαθηκης καινης μεσιτης εστιν οπως θανατου γενομενου εις απολυτρωσιν των επι τη πρωτη διαθηκη παραβασεων την επαγγελιαν λαβωσιν οι κεκλημενοι της αιωνιου κληρονομιας"
Hebreos,9,16,"Porque donde hay testamento, necesario es que intervenga muerte del testador. οπου γαρ διαθηκη θανατον αναγκη φερεσθαι του διαθεμενου"
Hebreos,9,17,Porque el testamento con la muerte es confirmado; de otra manera no es válido entre tanto que el testador vive. διαθηκη γαρ επι νεκροις βεβαια επει μη τοτε ισχυει οτε ζη ο διαθεμενος
Hebreos,9,18,De donde vino que ni aun el primero fué consagrado sin sangre. οθεν ουδε η πρωτη χωρις αιματος εγκεκαινισται
Hebreos,9,19,"Porque habiendo leído Moisés todos los mandamientos de la ley a todo el pueblo, tomando la sangre de los becerros y de los machos cabríos, con agua, y lana de grana, e  hisopo, roció al mismo libro, y también a todo el pueblo, λαληθεισης γαρ πασης εντολης κατα τον νομον υπο μωυσεως παντι τω λαω λαβων το αιμα των μοσχων και των τραγων μετα υδατος και εριου κοκκινου και υσσωπου αυτο τε το βιβλιον και παντα τον λαον ερραντισεν"
Hebreos,9,20,diciendo: Esta es la sangre del testamento que Dios os ha mandado. λεγων τουτο το αιμα της διαθηκης ης ενετειλατο προς υμας ο θεος
Hebreos,9,21,Y además de esto roció también con la sangre el tabernáculo y todos los vasos del ministerio. και την σκηνην δε και παντα τα σκευη της λειτουργιας τω αιματι ομοιως ερραντισεν
Hebreos,9,22,Y casi todo es purificado según la ley con sangre; y sin derramamiento de sangre no se hace remisión. και σχεδον εν αιματι παντα καθαριζεται κατα τον νομον και χωρις αιματεκχυσιας ου γινεται αφεσις
Hebreos,9,23,"Fué, pues, necesario que las figuras de las cosas celestiales fuesen purificadas con estas cosas; empero las mismas cosas celestiales con mejores sacrificios que éstos. αναγκη ουν τα μεν υποδειγματα των εν τοις ουρανοις τουτοις καθαριζεσθαι αυτα δε τα επουρανια κρειττοσιν θυσιαις παρα ταυτας"
Hebreos,9,24,"Porque no entró Cristo en el santuario hecho de mano, figura del verdadero, sino en el mismo cielo para presentarse ahora por nosotros en la presencia de Dios. ου γαρ εις χειροποιητα εισηλθεν αγια χριστος αντιτυπα των αληθινων αλλ εις αυτον τον ουρανον νυν εμφανισθηναι τω προσωπω του θεου υπερ ημων"
Hebreos,9,25,"Y no para ofrecerse muchas veces a sí mismo, como entra el pontífice en el santuario cada año con sangre ajena; ουδ ινα πολλακις προσφερη εαυτον ωσπερ ο αρχιερευς εισερχεται εις τα αγια κατ ενιαυτον εν αιματι αλλοτριω"
Hebreos,9,26,"de otra manera fuera necesario que hubiera padecido muchas veces desde el principio del mundo: mas ahora una vez en la consumación de los siglos, para deshacimiento del pecado se presentó por el sacrificio de sí mismo. επει εδει αυτον πολλακις παθειν απο καταβολης κοσμου νυνι δε απαξ επι συντελεια των αιωνων εις αθετησιν της αμαρτιας δια της θυσιας αυτου πεφανερωται"
Hebreos,9,27,"Y de la manera que está establecido a los hombres que mueran una vez, y después el juicio; και καθ οσον αποκειται τοις ανθρωποις απαξ αποθανειν μετα δε τουτο κρισις"
Hebreos,9,28,"así también Cristo fué ofrecido una vez para agotar los pecados de muchos; y la segunda vez, sin pecado, será visto de los que le esperan para salud. ουτως και ο χριστος απαξ προσενεχθεις εις το πολλων ανενεγκειν αμαρτιας εκ δευτερου χωρις αμαρτιας οφθησεται τοις αυτον απεκδεχομενοις εις σωτηριαν"
Hebreos,10,1,"Porque la ley, teniendo la sombra de los bienes venideros, no la imagen misma de las cosas, nunca puede, por los mismos sacrificios que ofrecen continuamente cada año, hacer perfectos a los que se allegan. σκιαν γαρ εχων ο νομος των μελλοντων αγαθων ουκ αυτην την εικονα των πραγματων κατ ενιαυτον ταις αυταις θυσιαις ας προσφερουσιν εις το διηνεκες ουδεποτε δυνανται τους προσερχομενους τελειωσαι"
Hebreos,10,2,"De otra manera cesarían de ofrecerse; porque los que tributan este culto, limpios de una vez, no tendrían más conciencia de pecado. επει ουκ αν επαυσαντο προσφερομεναι δια το μηδεμιαν εχειν ετι συνειδησιν αμαρτιων τους λατρευοντας απαξ κεκαθαρισμενους"
Hebreos,10,3,Empero en estos sacrificios cada año se hace conmemoración de los pecados. αλλ εν αυταις αναμνησις αμαρτιων κατ ενιαυτον
Hebreos,10,4,Porque la sangre de los toros y de los machos cabríos no puede quitar los pecados. αδυνατον γαρ αιμα ταυρων και τραγων αφαιρειν αμαρτιας
Hebreos,10,5,"Por lo cual, entrando en el mundo, dice: sacrificio y presente no quisiste; Mas me apropiaste cuerpo: διο εισερχομενος εις τον κοσμον λεγει θυσιαν και προσφοραν ουκ ηθελησας σωμα δε κατηρτισω μοι"
Hebreos,10,6,Holocaustos y expiaciones por el pecado no te agradaron. ολοκαυτωματα και περι αμαρτιας ουκ ευδοκησας
Hebreos,10,7,"Entonces dije: Heme aquí (En la cabecera del libro está escrito de mí) para que haga, oh Dios, tu voluntad. τοτε ειπον ιδου ηκω εν κεφαλιδι βιβλιου γεγραπται περι εμου του ποιησαι ο θεος το θελημα σου"
Hebreos,10,8,"Diciendo arriba: Sacrificio y presente, y holocaustos y expiaciones por el pecado no quisiste, ni te agradaron, (las cuales cosas se ofrecen según la ley) ανωτερον λεγων οτι θυσιας και προσφορας και ολοκαυτωματα και περι αμαρτιας ουκ ηθελησας ουδε ευδοκησας αιτινες κατα νομον προσφερονται"
Hebreos,10,9,"entonces dijo: Heme aquí para que haga, oh Dios, tu voluntad. Quita lo primero, para establecer lo postrero. τοτε ειρηκεν ιδου ηκω του ποιησαι το θελημα σου αναιρει το πρωτον ινα το δευτερον στηση"
Hebreos,10,10,En la cual voluntad somos santificados por la ofrenda del cuerpo de Jesucristo hecha una sola vez. εν ω θεληματι ηγιασμενοι εσμεν δια της προσφορας του σωματος ιησου χριστου εφαπαξ
Hebreos,10,11,"Así que, todo sacerdote se presenta cada día ministrando y ofreciendo muchas veces los mismos sacrificios, que nunca pueden quitar los pecados: και πας μεν ιερευς εστηκεν καθ ημεραν λειτουργων και τας αυτας πολλακις προσφερων θυσιας αιτινες ουδεποτε δυνανται περιελειν αμαρτιας"
Hebreos,10,12,"Pero éste, habiendo ofrecido por los pecados un solo sacrificio para siempre, está sentado a la diestra de Dios, ουτος δε μιαν υπερ αμαρτιων προσενεγκας θυσιαν εις το διηνεκες εκαθισεν εν δεξια του θεου"
Hebreos,10,13,"esperando lo que resta, hasta que sus enemigos sean puestos por estrado de sus pies. το λοιπον εκδεχομενος εως τεθωσιν οι εχθροι αυτου υποποδιον των ποδων αυτου"
Hebreos,10,14,Porque con una sola ofrenda hizo perfectos para siempre a los santificados. μια γαρ προσφορα τετελειωκεν εις το διηνεκες τους αγιαζομενους
Hebreos,10,15,Y atestíguanos lo mismo el Espíritu Santo; que después que dijo: μαρτυρει δε ημιν και το πνευμα το αγιον μετα γαρ το ειρηκεναι
Hebreos,10,16,"Y este es el pacto que haré con ellos Después de aquellos días, dice el Señor: Daré mis leyes en sus corazones, y en sus almas las escribiré: αυτη η διαθηκη ην διαθησομαι προς αυτους μετα τας ημερας εκεινας λεγει κυριος διδους νομους μου επι καρδιας αυτων και επι την διανοιαν αυτων επιγραψω αυτους"
Hebreos,10,17,Añade: Y nunca más me acordaré de sus pecados e  iniquidades. και των αμαρτιων αυτων και των ανομιων αυτων ου μη μνησθησομαι ετι
Hebreos,10,18,"Pues donde hay remisión de éstos, no hay más ofrenda por pecado. οπου δε αφεσις τουτων ουκετι προσφορα περι αμαρτιας"
Hebreos,10,19,"Así que, hermanos, teniendo libertad para entrar en el santuario por la sangre de Jesucristo, εχοντες ουν αδελφοι παρρησιαν εις την εισοδον των αγιων εν τω αιματι ιησου"
Hebreos,10,20,"por el camino que él nos consagró nuevo y vivo, por el velo, esto es, por su carne; ην ενεκαινισεν ημιν οδον προσφατον και ζωσαν δια του καταπετασματος τουτ εστιν της σαρκος αυτου"
Hebreos,10,21,"y teniendo un gran sacerdote sobre la casa de Dios, και ιερεα μεγαν επι τον οικον του θεου"
Hebreos,10,22,"lleguémonos con corazón verdadero, en plena certidumbre de fe, purificados los corazones de mala conciencia, y lavados los cuerpos con agua limpia. προσερχωμεθα μετα αληθινης καρδιας εν πληροφορια πιστεως ρεραντισμενοι τας καρδιας απο συνειδησεως πονηρας και λελουσμενοι το σωμα υδατι καθαρω"
Hebreos,10,23,Mantengamos firme la profesión de nuestra fe sin fluctuar; que fiel es el que prometió: κατεχωμεν την ομολογιαν της ελπιδος ακλινη πιστος γαρ ο επαγγειλαμενος
Hebreos,10,24,Y considerémonos los unos a los otros para provocarnos al amor y a las buenas obras; και κατανοωμεν αλληλους εις παροξυσμον αγαπης και καλων εργων
Hebreos,10,25,"no dejando nuestra congregación, como algunos tienen por costumbre, mas exhortándonos; y tanto más, cuanto veis que aquel día se acerca. μη εγκαταλειποντες την επισυναγωγην εαυτων καθως εθος τισιν αλλα παρακαλουντες και τοσουτω μαλλον οσω βλεπετε εγγιζουσαν την ημεραν"
Hebreos,10,26,"Porque si pecáremos voluntariamente después de haber recibido el conocimiento de la verdad, ya no queda sacrificio por el pecado, εκουσιως γαρ αμαρτανοντων ημων μετα το λαβειν την επιγνωσιν της αληθειας ουκετι περι αμαρτιων απολειπεται θυσια"
Hebreos,10,27,"sino una horrenda esperanza de juicio, y hervor de fuego que ha de devorar a los adversarios. φοβερα δε τις εκδοχη κρισεως και πυρος ζηλος εσθιειν μελλοντος τους υπεναντιους"
Hebreos,10,28,"El que menospreciare la ley de Moisés, por el testimonio de dos o de tres testigos muere sin ninguna misericordia: αθετησας τις νομον μωυσεως χωρις οικτιρμων επι δυσιν η τρισιν μαρτυσιν αποθνησκει"
Hebreos,10,29,"¿Cuánto pensáis que será más digno de mayor castigo, el que hollare al Hijo de Dios, y tuviere por inmunda la sangre del testamento, en la cual fué santificado, e  hiciere afrenta al Espíritu de gracia? ποσω δοκειτε χειρονος αξιωθησεται τιμωριας ο τον υιον του θεου καταπατησας και το αιμα της διαθηκης κοινον ηγησαμενος εν ω ηγιασθη και το πνευμα της χαριτος ενυβρισας"
Hebreos,10,30,"Sabemos quién es el que dijo: Mía es la venganza, yo daré el pago, dice el Señor. Y otra vez: El Señor juzgará su pueblo. οιδαμεν γαρ τον ειποντα εμοι εκδικησις εγω ανταποδωσω και παλιν κρινει κυριος τον λαον αυτου"
Hebreos,10,31,Horrenda cosa es caer en las manos del Dios vivo. φοβερον το εμπεσειν εις χειρας θεου ζωντος
Hebreos,10,32,"Empero traed a la memoria los días pasados, en los cuales, después de haber sido iluminados, sufristeis gran combate de aflicciones: αναμιμνησκεσθε δε τας προτερον ημερας εν αις φωτισθεντες πολλην αθλησιν υπεμεινατε παθηματων"
Hebreos,10,33,"Por una parte, ciertamente, con vituperios y tribulaciones fuisteis hechos espectáculo; y por otra parte hechos compañeros de los que estaban en tal estado. τουτο μεν ονειδισμοις τε και θλιψεσιν θεατριζομενοι τουτο δε κοινωνοι των ουτως αναστρεφομενων γενηθεντες"
Hebreos,10,34,"Porque de mis prisiones también os resentisteis conmigo, y el robo de vuestros bienes padecisteis con gozo, conociendo que tenéis en vosotros una mejor sustancia en los cielos, y que permanece. και γαρ τοις δεσμιοις συνεπαθησατε και την αρπαγην των υπαρχοντων υμων μετα χαρας προσεδεξασθε γινωσκοντες εχειν εαυτους κρειττονα υπαρξιν και μενουσαν"
Hebreos,10,35,"No perdáis pues vuestra confianza, que tiene grande remuneración de galardón: μη αποβαλητε ουν την παρρησιαν υμων ητις εχει μεγαλην μισθαποδοσιαν"
Hebreos,10,36,"Porque la paciencia os es necesaria; para que, habiendo hecho la voluntad de Dios, obtengáis la promesa. υπομονης γαρ εχετε χρειαν ινα το θελημα του θεου ποιησαντες κομισησθε την επαγγελιαν"
Hebreos,10,37,"Porque aun un poquito, Y el que ha de venir vendrá, y no tardará. ετι γαρ μικρον οσον οσον ο ερχομενος ηξει και ου χρονισει"
Hebreos,10,38,"Ahora el justo vivirá por fe; Mas si se retirare, no agradará a mi alma. ο δε δικαιος [μου] εκ πιστεως ζησεται και εαν υποστειληται ουκ ευδοκει η ψυχη μου εν αυτω"
Hebreos,10,39,"Pero nosotros no somos tales que nos retiremos para perdición, sino fieles para ganancia del alma. ημεις δε ουκ εσμεν υποστολης εις απωλειαν αλλα πιστεως εις περιποιησιν ψυχης"
Hebreos,11,1,"Es pues la fe la sustancia de las cosas que se esperan, la demostración de las cosas que no se ven. εστιν δε πιστις ελπιζομενων υποστασις πραγματων ελεγχος ου βλεπομενων"
Hebreos,11,2,Porque por ella alcanzaron testimonio los antiguos. εν ταυτη γαρ εμαρτυρηθησαν οι πρεσβυτεροι
Hebreos,11,3,"Por la fe entendemos haber sido compuestos los siglos por la palabra de Dios, siendo hecho lo que se ve, de lo que no se veía. πιστει νοουμεν κατηρτισθαι τους αιωνας ρηματι θεου εις το μη εκ φαινομενων το βλεπομενον γεγονεναι"
Hebreos,11,4,"Por la fe Abel ofreció a Dios mayor sacrificio que Caín, por la cual alcanzó testimonio de que era justo, dando Dios testimonio a sus presentes; y difunto, aun habla por ella. πιστει πλειονα θυσιαν αβελ παρα καιν προσηνεγκεν τω θεω δι ης εμαρτυρηθη ειναι δικαιος μαρτυρουντος επι τοις δωροις αυτου του θεου και δι αυτης αποθανων ετι λαλει"
Hebreos,11,5,"Por la fe Enoc fué traspuesto para no ver muerte, y no fué hallado, porque lo traspuso Dios. Y antes que fuese traspuesto, tuvo testimonio de haber agradado a Dios. πιστει ενωχ μετετεθη του μη ιδειν θανατον και ουχ ηυρισκετο διοτι μετεθηκεν αυτον ο θεος προ γαρ της μεταθεσεως μεμαρτυρηται ευαρεστηκεναι τω θεω"
Hebreos,11,6,"Empero sin fe es imposible agradar a Dios; porque es menester que el que a Dios se allega, crea que le hay, y que es galardonador de los que le buscan. χωρις δε πιστεως αδυνατον ευαρεστησαι πιστευσαι γαρ δει τον προσερχομενον [τω] θεω οτι εστιν και τοις εκζητουσιν αυτον μισθαποδοτης γινεται"
Hebreos,11,7,"Por la fe Noé, habiendo recibido respuesta de cosas que aun no se veían, con temor aparejó el arca en que su casa se salvase: por la cual fe condenó al mundo, y fué hecho heredero de la justicia que es por la fe. πιστει χρηματισθεις νωε περι των μηδεπω βλεπομενων ευλαβηθεις κατεσκευασεν κιβωτον εις σωτηριαν του οικου αυτου δι ης κατεκρινεν τον κοσμον και της κατα πιστιν δικαιοσυνης εγενετο κληρονομος"
Hebreos,11,8,"Por la fe Abraham, siendo llamado, obedeció para salir al lugar que había de recibir por heredad; y salió sin saber dónde iba. πιστει καλουμενος αβρααμ υπηκουσεν εξελθειν εις τοπον ον ημελλεν λαμβανειν εις κληρονομιαν και εξηλθεν μη επισταμενος που ερχεται"
Hebreos,11,9,"Por fe habitó en la tierra prometida como en tierra ajena, morando en cabañas con Isaac y Jacob, herederos juntamente de la misma promesa: πιστει παρωκησεν εις γην της επαγγελιας ως αλλοτριαν εν σκηναις κατοικησας μετα ισαακ και ιακωβ των συγκληρονομων της επαγγελιας της αυτης"
Hebreos,11,10,"Porque esperaba ciudad con fundamentos, el artífice y hacedor de la cual es Dios. εξεδεχετο γαρ την τους θεμελιους εχουσαν πολιν ης τεχνιτης και δημιουργος ο θεος"
Hebreos,11,11,"Por la fe también la misma Sara, siendo estéril, recibió fuerza para concebir simiente; y parió aun fuera del tiempo de la edad, porque creyó ser fiel el que lo había prometido. πιστει και αυτη σαρρα δυναμιν εις καταβολην σπερματος ελαβεν και παρα καιρον ηλικιας επει πιστον ηγησατο τον επαγγειλαμενον"
Hebreos,11,12,"Por lo cual también, de uno, y ése ya amortecido, salieron como las estrellas del cielo en multitud, y como la arena inmunerable que está a la orilla de la mar. διο και αφ ενος εγεννηθησαν και ταυτα νενεκρωμενου καθως τα αστρα του ουρανου τω πληθει και ως η αμμος η παρα το χειλος της θαλασσης η αναριθμητος"
Hebreos,11,13,"Conforme a la fe murieron todos éstos sin haber recibido las promesas, sino mirándolas de lejos, y creyéndolas, y saludándolas, y confesando que eran peregrinos y advenedizos sobre la tierra. κατα πιστιν απεθανον ουτοι παντες μη κομισαμενοι τας επαγγελιας αλλα πορρωθεν αυτας ιδοντες και ασπασαμενοι και ομολογησαντες οτι ξενοι και παρεπιδημοι εισιν επι της γης"
Hebreos,11,14,"Porque los que esto dicen, claramente dan a entender que buscan una patria. οι γαρ τοιαυτα λεγοντες εμφανιζουσιν οτι πατριδα επιζητουσιν"
Hebreos,11,15,"Que si se acordaran de aquella de donde salieron, cierto tenían tiempo para volverse: και ει μεν εκεινης εμνημονευον αφ ης εξεβησαν ειχον αν καιρον ανακαμψαι"
Hebreos,11,16,"Empero deseaban la mejor, es a saber, la celestial; por lo cual Dios no se avergüenza de llamarse Dios de ellos: porque les había aparejado ciudad. νυν δε κρειττονος ορεγονται τουτ εστιν επουρανιου διο ουκ επαισχυνεται αυτους ο θεος θεος επικαλεισθαι αυτων ητοιμασεν γαρ αυτοις πολιν"
Hebreos,11,17,"Por fe ofreció Abraham a Isaac cuando fué probado, y ofrecía al unigénito el que había recibido las promesas, πιστει προσενηνοχεν αβρααμ τον ισαακ πειραζομενος και τον μονογενη προσεφερεν ο τας επαγγελιας αναδεξαμενος"
Hebreos,11,18,habiéndole sido dicho: En Isaac te será llamada simiente: προς ον ελαληθη οτι εν ισαακ κληθησεται σοι σπερμα
Hebreos,11,19,Pensando que aun de los muertos es Dios poderoso para levantar; de donde también le volvió a recibir por figura. λογισαμενος οτι και εκ νεκρων εγειρειν δυνατος ο θεος οθεν αυτον και εν παραβολη εκομισατο
Hebreos,11,20,Por fe bendijo Isaac a Jacob y a Esaú respecto a cosas que habían de ser. πιστει και περι μελλοντων ευλογησεν ισαακ τον ιακωβ και τον ησαυ
Hebreos,11,21,"Por fe Jacob, muriéndose, bendijo a cada uno de los hijos de José, y adoró estribando sobre la punta de su bordón. πιστει ιακωβ αποθνησκων εκαστον των υιων ιωσηφ ευλογησεν και προσεκυνησεν επι το ακρον της ραβδου αυτου"
Hebreos,11,22,"Por fe José, muriéndose, se acordó de la partida de los hijos de Israel; y dió mandamiento acerca de sus huesos. πιστει ιωσηφ τελευτων περι της εξοδου των υιων ισραηλ εμνημονευσεν και περι των οστεων αυτου ενετειλατο"
Hebreos,11,23,"Por fe Moisés, nacido, fué escondido de sus padres por tres meses, porque le vieron hermoso niño; y no temieron el mandamiento del rey. πιστει μωυσης γεννηθεις εκρυβη τριμηνον υπο των πατερων αυτου διοτι ειδον αστειον το παιδιον και ουκ εφοβηθησαν το διαταγμα του βασιλεως"
